third_party/metronome/results/sustained_fd/svmcpm_dist_n2.json

{"total": 2, "duration": 75.0, "budget_ms": 1000.0, "ev": [[1.0164709091186523, 316.8978560715914, 0], [1.0166339874267578, 316.8978560715914, 0], [2.017303466796875, 317.31203105300665, 0], [2.017467737197876, 317.31203105300665, 0], [3.0017619132995605, 300.9833456017077, 0], [3.0019829273223877, 300.9833456017077, 0], [3.998178720474243, 296.4655361138284, 0], [3.998344898223877, 296.4655361138284, 0], [4.999185562133789, 297.2941012121737, 0], [4.9993510246276855, 297.2941012121737, 0], [5.999782562255859, 296.68801883235574, 0], [5.999948024749756, 296.68801883235574, 0], [7.010893106460571, 307.54545517265797, 0], [7.011054039001465, 307.54545517265797, 0], [8.01009726524353, 305.8276902884245, 0], [8.010320663452148, 305.8276902884245, 0], [9.001728534698486, 296.9846520572901, 0], [9.001894474029541, 296.9846520572901, 0], [10.002033233642578, 296.84273479506373, 0], [10.002197742462158, 296.84273479506373, 0], [11.003079652786255, 296.9756261445582, 0], [11.00330114364624, 296.9756261445582, 0], [12.003894567489624, 296.75720166414976, 0], [12.00405478477478, 296.75720166414976, 0], [13.003774166107178, 296.79973889142275, 0], [13.00399661064148, 296.79973889142275, 0], [14.004966497421265, 296.71102901920676, 0], [14.005146026611328, 296.71102901920676, 0], [15.005023002624512, 296.9525922089815, 0], [15.005203008651733, 296.9525922089815, 0], [16.025291919708252, 316.616368945688, 0], [16.02542233467102, 316.616368945688, 0], [17.02608036994934, 316.7032329365611, 0], [17.026246309280396, 316.7032329365611, 0], [18.005823135375977, 296.2028328329325, 0], [18.00598907470703, 296.2028328329325, 0], [19.006642818450928, 296.3523590005934, 0], [19.006808042526245, 296.3523590005934, 0], [20.00730538368225, 296.76566319540143, 0], [20.007471799850464, 296.76566319540143, 0], [21.007508516311646, 296.5292651206255, 0], [21.007673740386963, 296.5292651206255, 0], [22.007771253585815, 296.60539701581, 0], [22.00799298286438, 296.60539701581, 0], [23.008159637451172, 296.9329869374633, 0], [23.00832509994507, 296.9329869374633, 0], [24.0078067779541, 296.4275791309774, 0], [24.007986783981323, 296.4275791309774, 0], [25.00921893119812, 296.89348116517067, 0], [25.00939917564392, 296.89348116517067, 0], [26.009863138198853, 296.97433626279235, 0], [26.010226249694824, 296.97433626279235, 0], [27.010183334350586, 296.959828119725, 0], [27.010364055633545, 296.959828119725, 0], [28.011537075042725, 297.00288688763976, 0], [28.01170253753662, 297.00288688763976, 0], [29.011908769607544, 297.02875716611743, 0], [29.012089729309082, 297.02875716611743, 0], [30.012072324752808, 296.7794849537313, 0], [30.01225233078003, 296.7794849537313, 0], [31.03272843360901, 316.71539414674044, 0], [31.03290891647339, 316.71539414674044, 0], [32.03364014625549, 316.7872419580817, 0], [32.033820390701294, 316.7872419580817, 0], [33.0147488117218, 296.8842340633273, 0], [33.01492881774902, 296.8842340633273, 0], [34.01470637321472, 296.5582530014217, 0], [34.0148708820343, 296.5582530014217, 0], [35.01566028594971, 296.80900694802403, 0], [35.01584076881409, 296.80900694802403, 0], [36.01581525802612, 296.7203170992434, 0], [36.01602244377136, 296.7203170992434, 0], [37.016971588134766, 296.55242804437876, 0], [37.01713681221008, 296.55242804437876, 0], [38.01892137527466, 298.41156816110015, 0], [38.019086837768555, 298.41156816110015, 0], [39.01766586303711, 296.8179858289659, 0], [39.017831802368164, 296.8179858289659, 0], [40.01895308494568, 297.30181070044637, 0], [40.019174337387085, 297.30181070044637, 0], [41.01877522468567, 296.8801576644182, 0], [41.0189414024353, 296.8801576644182, 0], [42.01944327354431, 296.67899990454316, 0], [42.01960825920105, 296.67899990454316, 0], [43.020408153533936, 296.63559794425964, 0], [43.02057456970215, 296.63559794425964, 0], [44.021167039871216, 296.8444530852139, 0], [44.02134084701538, 296.8444530852139, 0], [45.02126216888428, 296.50268610566854, 0], [45.021427392959595, 296.50268610566854, 0], [46.022003173828125, 296.5514659881592, 0], [46.02216815948486, 296.5514659881592, 0], [47.022820234298706, 296.66555812582374, 0], [47.02298665046692, 296.66555812582374, 0], [48.02351498603821, 296.74681508913636, 0], [48.023681640625, 296.74681508913636, 0], [49.02410650253296, 296.5553989633918, 0], [49.0242714881897, 296.5553989633918, 0], [50.02476119995117, 296.4719799347222, 0], [50.024927616119385, 296.4719799347222, 0], [51.0251259803772, 296.7427000403404, 0], [51.02534818649292, 296.7427000403404, 0], [52.02503776550293, 296.5987757779658, 0], [52.02520442008972, 296.5987757779658, 0], [53.025211572647095, 296.3048326782882, 0], [53.02537679672241, 296.3048326782882, 0], [54.02590775489807, 296.5780352242291, 0], [54.02607202529907, 296.5780352242291, 0], [55.02724575996399, 296.5974882245064, 0], [55.02740979194641, 296.5974882245064, 0], [56.02836871147156, 297.18331014737487, 0], [56.02854776382446, 297.18331014737487, 0], [57.02809524536133, 296.7087640427053, 0], [57.02827548980713, 296.7087640427053, 0], [58.027852058410645, 296.48335417732596, 0], [58.02803325653076, 296.48335417732596, 0], [59.05014610290527, 317.43980664759874, 0], [59.05031108856201, 317.43980664759874, 0], [60.050089836120605, 317.2988388687372, 0], [60.05031061172485, 317.2988388687372, 0], [61.05076050758362, 316.7759710922837, 0], [61.05092692375183, 316.7759710922837, 0], [62.03188967704773, 297.02470311895013, 0], [62.032050132751465, 297.02470311895013, 0], [63.03224492073059, 296.8180109746754, 0], [63.03242611885071, 296.8180109746754, 0], [64.03220582008362, 296.63927806541324, 0], [64.03231930732727, 296.63927806541324, 0], [65.03296160697937, 296.8012522906065, 0], [65.03312587738037, 296.8012522906065, 0], [66.03427481651306, 297.3265880718827, 0], [66.0344409942627, 297.3265880718827, 0], [67.03462672233582, 296.7377151362598, 0], [67.03479194641113, 296.7377151362598, 0], [68.03519248962402, 296.75963381305337, 0], [68.0353569984436, 296.75963381305337, 0], [69.04540014266968, 306.9801381789148, 0], [69.04556679725647, 306.9801381789148, 0], [70.03607368469238, 296.6932528652251, 0], [70.03625464439392, 296.6932528652251, 0], [71.0367500782013, 296.7416630126536, 0], [71.03695726394653, 296.7416630126536, 0], [72.03773331642151, 296.7980392277241, 0], [72.03791308403015, 296.7980392277241, 0], [73.037682056427, 296.611612662673, 0], [73.03786301612854, 296.611612662673, 0], [74.03900074958801, 296.7958599328995, 0], [74.03916621208191, 296.7958599328995, 0]], "ttfa": [318.0, 318.0], "err": 0, "audio_out": 0, "p50": 296.7988890595734, "p90": 316.7032329365611, "p99": 317.37975211814046, "miss": 0.0}

.context/papers/Live CC- Learning Video LLM with Streaming Speech Transcription at Scale/paper.md

### 9.2. Commentary Quality

Video Time = 13.3s, Current Processing Latency = 0.15
Time = 0.0s: the planets
Time = 2.0s: in our solar
Time = 2.0s: system are all
Time = 3.0s: different in their
Time = 4.0s: own way but they
Time = 5.0s: all have one thing
Time = 6.0s: in common they all
Time = 7.0s: orbit the Sun
Time = 8.0s: welcome to beyond
Time = 9.0s: nature and today
Time = 10.0s: we're going to be
Time = 11.0s: talking about the planets
Time = 12.0s: in our solar
Time = 13.0s: system and their

Video Time = 31.6s, Current Processing Latency = 0.12
Time = 0.0s: the planets
Time = 2.0s: in our solar
Time = 2.0s: system are all
Time = 3.0s: different in their
Time = 4.0s: own way but they
Time = 5.0s: all have one thing
Time = 6.0s: in common they all
Time = 7.0s: orbit the Sun
Time = 8.0s: welcome to beyond
Time = 9.0s: nature and today
Time = 10.0s: we're going to be
Time = 11.0s: in common they all
Time = 12.0s: in our solar
Time = 13.0s: distance from the planets
Time = 14.0s: characteristics the planets
Time = 15.0s: in our solar
Time = 16.0s: our solar system
Time = 17.0s: are Mercury venus
Time = 18.0s: Earth Mars
Time = 19.0s: Jupiter Saturn
Time = 20.0s: Uranus and Neptune Mercury
Time = 21.0s: is the smallest
Time = 22.0s: is the smallest
Time = 23.0s: planet in our solar system
Time = 24.0s: solar system and is the closest to the Sun
Time = 25.0s: the closest to the Sun
Time = 26.0s: Sun it is one of the two systems
Time = 27.0s: hottest planet in our solar system with an average distance of 58 million
Time = 28.0s: solar system with an average distance of 58 million
Time = 29.0s: of the Sun
Time = 30.0s: to the Sun
Time = 31.0s: to the Sun
Time = 32.0s: is the smallest
Time = 33.0s: distance from the planets
Time = 34.0s: Sun of 36
Time = 35.0s: million miles mercury
Time = 36.0s: is also the Sun
Time = 37.0s: planet in our solar system
Time = 38.0s: system that does not have a moon and
Time = 39.0s: has a diameter of 4.879 km
Time = 40.0s: has a diameter of 3.031 mi
Time = 41.0s: has a diameter of 4.879 km
Time = 42.0s: is a�: million of eight
Time = 43.0s: is: million of seven
Time = 44.0s: also three
Time = 45.0s: thousand thirty-one miles
Time = 46.0s: is: one of the 7.00000000000000000000000000000000000000000000000000000000000000000000000000000000000000000000000000000000000000000000000000000000000000000000000000000000000000000000000000000000000000000000000000000000000000000000000000000000000000000000000000000000000000000000000000000000000000000000000000000000000000000000000000000000000000000000000000000000000000000000000000000000000000000000000000000000000000000000000000000000000000000000000000000000000000000000000000000000000000000000000000000000000000000000000000000000000000000000000000000000000000000000000000000000000000000000000000000000000000000000000000000000000000000000000000000000000000000000000000000000000000000000000000000000000000000000000000000000000000000000000000000000000000000000000000000000000000000000000000000000000000000000000000000000000000000000000000000000000000000000000000000000000000000000000000000000000000000000000000000000000000000000000000000000000000000000000000000000000000000000000000000000000000000000000000000000000000000000000000000000000000000000000000000000000000000000000000000000000000000000000000000000000000000000000000000000000000000000000000000000000000000000000000000000000000000000000000000000000000000000000000000000000000000000000000000000000000000000000000000000000000000000000000000000000000000000000000000000000000000000000000000000000000000000000000000000000000000000000000000000000000000000000000000000000000000000000000000000000000000000000000000000000000000000000000000000000000000000000000000000000000000000000000000000000000000000000000000000000000000000000000000000000000000000000000000000000000000000000000000000000000000000000000000000000000000000000000000000000000000000000000000000000000000000000000000000000000000000000000000000000000000000000000000000000000000000000000000000000000000000000000000000000000000000000000000000000000000000000000000000000000000000000000000000000000000000000000000000000000000000000000000000000000000000000000000000000000000000000000000000000000000000000000000000000000000000000000000000000000000000000000000000000000000000000000000000000000000000000000000000000000000000000000000000000000000000000000000000000000000000000000000000000000000000000000000000000000000000000000000000000000000000000000000000000000000000000000000000000000000000000000000000000000000000000000000000000000000000000000000000000000000000000000000000000000000000000000000000000000000000000000000000000000000000000000000000000000000000000000000000000000000000000000000000000000000000000000000000000000000000000000000000000000000000000000000000000000000000000000000000000000000000000000000000000000000000000000000000000000000000000000000000000000000000000000000000000000000000000000000000000000000000000000000000000000000000000000000000000000000000000000000000000000000000000000000000000000000000000000000000000000000000000000000000000000000000000000000000000000000000000000000000000000000000000000000000000000000000000000000000000000000000000000000000000000000000000000000000000000000000000000000000000000000000000000000000000000000000000000000000000000000000000000000000000000000000000000

Time = 0.8s: hey guys today
Time = 1.0s: I'm going to show
Time = 2.0s: you how to
Time = 3.0s: fix a water
Time = 4.0s: compared laptop first
Time = 5.0s: you're going to need
Time = 6.0s: I'm taking try, and
Time = 7.0s: your laptop then
Time = 8.0s: you're going to
Time = 9.0s: need some water
Time = 10.0s: and a microwave
Time = 11.0s: safe container pour
Time = 12.0s: the water into
Time = 13.0s: the container and
Time = 14.0s: then pour it
Time = 15.0s: over the laptop